<!DOCTYPE suite SYSTEM "http://beust.com/testng/testng-1.0.dtd" >
  
<suite name="Example" verbose="1">

  <listeners>
    <listener class-name="priority.PriorityInterceptor" />
  </listeners>
  
  <test name="Simple example" >
<!--
      <groups>
      <run>
        <include name="assert" />
        <include name="fail" />
        <include name="odd" />
        <include name="even" />
        <exclude name="broken" />
      </run>        
    </groups>
-->
    <classes>
      <class name="example1.Test1" />
    </classes>
  </test>
  
  <test name="Method interceptor example" >
    <classes>
      <class name="priority.PriorityTest" />
    </classes>
  </test>

</suite>
